{
  "id": "university-of-amsterdam-faculty-of-science",
  "name": "University of Amsterdam, Faculty of Science",
  "aliases": [],
  "website": "https://www.uva.nl/en/about-the-uva/organisation/faculties/faculty-of-science/faculty-of-science.html",
  "cause_areas": [],
  "hq_location": null,
  "size_estimate": null,
  "notes": null
}
