{
  "id": "institute-for-ai-policy-and-strategy",
  "name": "Institute for AI Policy and Strategy",
  "aliases": [],
  "website": "https://www.iaps.ai/",
  "cause_areas": [
    "AI safety & policy"
  ],
  "hq_location": "Washington, DC metro area, USA",
  "size_estimate": "11-20",
  "notes": null
}
