{
  "id": "massachusetts-institute-of-technology-abdul-latif-jameel-poverty-action-lab",
  "name": "Massachusetts Institute of Technology, Abdul Latif Jameel Poverty Action Lab",
  "aliases": [],
  "website": "https://www.povertyactionlab.org",
  "cause_areas": [],
  "hq_location": null,
  "size_estimate": null,
  "notes": null
}
