{
  "id": "european-union-ai-office",
  "name": "European Union, AI Office",
  "aliases": [],
  "website": "https://digital-strategy.ec.europa.eu/en/policies/ai-office",
  "cause_areas": [
    "AI safety & policy"
  ],
  "hq_location": "Brussels, Belgium",
  "size_estimate": "101+",
  "notes": null
}
