{
  "id": "national-university-of-singapore-saw-swee-hock-school-of-public-health",
  "name": "National University of Singapore, Saw Swee Hock School of Public Health",
  "aliases": [],
  "website": "https://nus.edu.sg/",
  "cause_areas": [],
  "hq_location": null,
  "size_estimate": null,
  "notes": null
}
